{
    "channels": [
        {
            "name": "ch",
            "samples": [
                {
                    "data": [1000.0],
                    "modifiers": [
                        {"data": null, "name": "mu_sig", "type": "normfactor"},
                        {
                            "data": {"hi": 1.5, "lo": 0.5},
                            "name": "unc",
                            "type": "normsys"
                        }
                    ],
                    "name": "signal"
                }
            ]
        }
    ],
    "measurements": [
        {
            "config": {
                "parameters": [
                    {
                        "name": "mu_sig",
                        "inits": [5]
                    }
                ],
                "poi": "mu_sig"
            },
            "name": "meas"
        }
    ],
    "observations": [{"data": [1000], "name": "ch"}],
    "version": "1.0.0"
}
